Title,Link,Article
Ofcom dismisses Tory ice sculpture complaint,https://www.bbc.com/news/entertainment-arts-50646185,"Ofcom has decided not to investigate a Conservative Party impartiality complaint about a Channel 4 special.The party complained ahead of the Climate Debate on 28 November about C4's intention to ""empty chair"" the Conservatives with an ice sculpture.It criticised the channel's refusal to accept Cabinet Minister Michael Gove as the Tory representative if the Prime Minister, Boris Johnson, didn't attend.But Ofcom concluded the Conservative viewpoint had been given due weight.The one-hour programme went on to ""empty chair"" both Mr Johnson and Brexit Party leader Nigel Farage, who was also replaced with an ice sculpture. In a statement, the media watchdog said: ""Ofcom's election committee concluded that, across the one-hour debate and a subsequent news programme, Channel 4's use of editorial techniques ensured that the Conservative's viewpoint on climate and environmental issues was adequately reflected and given due weight.""The Conservative complaint had described the use of the ice sculpture to replace Mr Johnson as ""a provocative partisan stunt"".But Ofcom said: ""The committee also took into account that the globe ice sculpture was not a representation of the Prime Minister personally, and little editorial focus was given to it, either visually or in references made by the presenter or debate participants.""Channel 4 told Ofcom the programme was intended to be a party leaders' debate from the outset.It added that the leaders of the Labour Party, the Liberal Democrats, Plaid Cymru, the SNP and the co-leader of the Green Party, all agreed to participate in the programme on the understanding it was a leaders' debate. Channel 4 said Mr Gove arrived unannounced at the ITN building ahead of the debate and requested the channel ask the other party leaders in attendance if they would agree to him participating instead of Mr Johnson. Channel 4 said it did so but they declined.Broadcasters have editorial freedom in determining the format of any election debate. Depending on the circumstances, they may choose to proceed without having agreed the participation of a particular political party or politician, providing they take steps to ensure the programme complies with Ofcom's due impartiality and election rules.Follow us on Facebook, or on Twitter @BBCNewsEnts. If you have a story suggestion email entertainment.news@bbc.co.uk."
Labour pledges to cap class sizes at 30 pupils,https://www.bbc.com/news/election-2019-50666078,"The Labour Party is promising to cap class sizes at 30 pupils across all schools in England if it wins next week's election.The pledge is an extension of a commitment in its manifesto to limit classes to this size at all primary schools. The party said it would fulfil the pledge by recruiting nearly 20,000 extra teachers over five years. The Conservatives said English schools were rising up international rankings.The party has pledged an extra £14bn over the next three years for schools in England. Labour's pledge to recruit nearly 20,000 teachers is similar to a promise made two weeks ago by the Liberal Democrats. Lib Dem education spokeswoman Layla Moran accused the party of trying to ""copy"" them, but added that Labour had ""no hope of meeting this target"".She added that Labour would not be able to ""square these promises"" with leaving the EU if voters back the party's Brexit deal in its planned referendum, due to ""thousands of EU teachers coming to work in schools each year"". Labour said the recruitment would be funded from an extra £25bn in schools spending over the next three years. The party has also committed to ensuring all teachers have formal teaching qualifications within five years.Shadow education secretary Angela Rayner said Labour's pledges would ""transform education standards in this country for every child"".""We will invest in record per pupil funding, restore the pupil premium and close the gap in support for children with special educational needs and disabilities, to give every child the support they need,"" she said.She accused the Conservatives of having ""slashed school funding for the first time in a generation, leaving pupils taught by unqualified teachers, crammed in to super-sized classes, and not receiving the support they need"".There is a teacher shortage in England, with the latest official statistics showing a 15% shortfall in numbers beginning training for secondary schools.  But Labour's promise to recruit more may not be easy to deliver.  In subjects such as physics, fewer than half the required graduates have begun to train.  Schools hire teachers, not the government, and it is harder to attract and keep teachers to work in poorer areas. The party also says it would cap all class sizes at 30. At the moment, just over 12% of secondary pupils are taught in classes with between 31-35 pupils. In 2009, when Labour was last in government, it was just over 10%.  While slightly smaller class sizes could appeal to parents, the international evidence suggests it may make less of a difference to results than the quality of teaching. The National Association of Head Teachers said 47,000 secondary teachers and 8,000 primary teachers would be needed by 2024 to keep pace with an expected increase in pupil numbers. Its general secretary Paul Whiteman said: ""We need significantly more recruits than Labour are suggesting just to meet rising demand, never mind reduce current class sizes."" ""The new recruits we need will not magically appear, and nor will they stay if we don't also address the stress and unnecessary workload that is widespread in the system.""Schools minister Nick Gibb said that in government Labour would ""would wreck the economy, leaving no money for public services"". He added that figures this week from the OECD's international school rankings showed English schools had risen up the league tables.He added that schools in Wales, where schools are run by the Labour-led devolved government, were the lowest performing within the UK. ""Conservative education reforms are improving standards in our schools, meaning children can get a better start in life,"" he added. Labour are also announcing new plans to tackle homelessness, including £100m a year for emergency winter shelters, £600m to build new hostels, and £200m to refurbish existing ones. In a speech later, shadow housing secretary John Healey will accuse the Conservatives of being ""directly responsible"" for an increase of people living on the streets. A Conservative party spokesman said: ""There is record investment going in to tackling homelessness - £1.2bn until April 2020 with a further £422m for 2020-21."" The Conservatives, like Labour, have pledged to end rough sleeping within five years if elected to government. "
Five key things in the BBC's Johnson-Corbyn debate,https://www.bbc.com/news/election-2019-50695308,"This head-to-head debate was touted as the last chance for both leaders to convince the public they are the best man for the job. But after a tumultuous week for both Boris Johnson and Jeremy Corbyn, did either of them succeed?We will find out for sure on 13 December, but for now, what were the key things from the 60-minute exchange?Let's be honest, it was always going to be a running theme in tonight's debate, wasn't it? For Mr Johnson, his phrase of ""get Brexit done"" was used tens of times  and seemed like his answer to most conundrums.  There were a few awkward moments, though, when he used this tactic - for example, when saying the nastiness in politics that had seen MPs threatened could be ended by his deal. But the PM also got the backing of some audience members for his determination to put the whole issue to bed and move forward with his other priorities.Mr Corbyn faced further scrutiny of Labour's Brexit position - to negotiate a deal with the EU and put it to a referendum - and his own position of staying neutral in any campaign. He was attacked by Mr Johnson for his ""failure of leadership"" by not taking a side, and asked repeatedly about his beliefs. But like the PM, Mr Corbyn won over some of the audience with his pledge to bring the country together, whatever the outcome of another vote on the EU - which he thinks he can achieve as PM by staying neutral.  We have never seen an election where former prime ministers have intervened in quite the way they have this time. Rather than coming out for their successors, the likes of Sir John Major and Tony Blair have been condemning the leaders and questioning whether voters should back them - especially over their positions on Brexit.In question one, we got our audience star in the form of John Purcell, as he asked whether such interventions were ""worrying"" to the party leaders. Or were the elder statesmen, Mr Purcell asked, ""just a couple of old has-beens""?The new kids on the block were polite to their predecessors, though happy to call them wrong.Mr Johnson said he had the ""utmost respect for all former Conservative leaders"" ""but I don't think [Sir John] is right"". Instead he repeated that the Tories had an ""oven-ready plan"" for Brexit, and it would lead to a stronger future for the UK. For Mr Corbyn, both Mr Blair and Sir John were ""welcome to make their comments"". But he ""urged them to think for a moment of the reality of nine years of austerity"" under the Tories before they cast their vote. A quick question emailed by a far-flung audience member really got to the core of the difference between a vote for Mr Johnson and one for Mr Corbyn. Which of the philosophies - socialism or capitalism - had helped the poor the most, the absent questioner asked? The Labour leader went first, ""Socialism, carried out in a democratic way, in this country, Scandinavia and elsewhere, has raised the living standards"", he said, citing the post-war Labour government which created the NHS. His rival then made the argument for capitalism, saying his ""One Nation Conservatism"" understood that having a ""dynamic market economy was the only way in which you can pay for fantastic public services"". And that, he said, offered the ""balance and symmetry"" needed. But Mr Johnson then went on to condemn his opposite's position, accusing Labour of wanting to ""overthrow capitalism"", and calling such an attack on it ""absolutely senseless"".Mr Corbyn, however, replied: ""My kind of socialism is one where you don't leave people behind"". He then accused the Tories of allowing inequality to grow. We can't see either leader swapping sides anytime soon. There was a titter from the audience when the two leaders were asked what punishment they deemed suitable for lying during political campaigns. Mr Johnson, to further audience giggles, called for such fibbers to be ""made to go on their knees through the chamber of the House of Commons"". He then turned his phrase to poke fun at some of Mr Corbyn's revelations, saying such politicians should be ""scourging themselves with copies of offending documents that claim to prove one thing and prove something different"".Mr Corbyn took a straighter approach to his answer, saying he wanted a ""stronger, not weaker House of Commons to hold the government to account"" - and hopefully one led by him. But he did get a hit back at Boris Johnson, saying there should be independent monitoring to ""test statements on the side of a bus"" for their validity. Some of these debates have become a little rowdy in the run-up to the December poll as emotions have run high. This final head-to-head avoided the boos the leaders had sometimes encountered in the campaign, and remained calm. But it did raise applause. It wasn't only their policies that got the claps going though - such as the regular promise to get Brexit done, by Mr Johnson, and repeated pledges for the NHS by Mr Corbyn . It was the jibes. Mr Johnson laid into his counterpart on a number of occasions, accusing him of supporting the IRA, wanting to ""break up the union"" and ""failure to take a stand"" over Brexit.But the Labour leader had his comebacks, and called for the PM to ""show a degree of honesty"" in his answers. The audience seemed to enjoy the bit of spice it added to the proceedings. Here's a concise guide to where the parties stand on key issues like Brexit, education and the NHS. "
What does 'Get Brexit done' mean?,https://www.bbc.com/news/uk-50222315,"The Conservative slogan ""Get Brexit done"" suggests a quick and easy path to leaving the European Union (EU), allowing the UK to focus on other things apart from Brexit. But it's not that simple.We know the Brexit deadline has been delayed again - this time until 31 January 2020.If the Conservatives win a clear majority in this election, Brexit day could be earlier than that, otherwise it could be delayed again.Either way, though, it won't be the end of the matter. Boris Johnson wants it to happen as soon as possible.""It is fair to say you're getting Brexit done because you are coming out of the EU and you're coming out of the legal order of the EU,"" the prime minister told the BBC.""You are really taking back control of all the things - money, border, rules - you are doing all that.""But while the day of Brexit would certainly be a big symbolic moment (loved and hated in equal measure), it would also leave an enormous amount unresolved.That's because Brexit is not really a single event - it's a complex process that will go on for years.The UK would no longer be a member state of the European Union. That would be a significant change. But - and this assumes the UK left with a withdrawal agreement - only a few issues would actually have been sorted out. Among other things:Almost everything else would still be up for grabs. Brexit would not be done. The legally binding deal we're talking about at the moment covers only the divorce, not the future relationship.That is dealt with in an accompanying political declaration, which is non-binding and sets only a direction of travel. A future government could still change course.  Initially, the UK would enter a transition period during which it would continue to follow all EU rules and regulations and continue to pay the same amount of money into the EU budget.The transition would be due to end in December 2020, but under the terms of the withdrawal agreement it could be extended by one or two years.The government, though, has now said it will not ask for any extension. The advantage of transition is it would be a soft landing. There would be no sudden changes to the way the economy works, which would give some certainty to businesses. And there would be time to start negotiating the shape of the future relationship between the UK and the EU.But for as long as it lasts, the UK would have to follow all the rules policed by the European Commission, and the jurisdiction of the European Court of Justice, without having any say in making those rules.There is a lot we need to talk about. What kind of free-trade arrangements would be put in place? What kind of security and police cooperation would be negotiated with the EU? How would data be exchanged in the future? It usually takes years to negotiate a free-trade deal but the UK and the EU would initially have a matter of months. The withdrawal agreement says the two sides would have to decide by 1 July 2020 whether to extend the post-Brexit transition period. So if the UK was to leave on 31 January, at the end of the current extension, there would be exactly five months to negotiate a trade deal. That's not enough, not even close.It's true the two sides would start from the same place (with all the same rules and regulations). But it's also true this would be the first trade deal in history when two parties were trying to move further away from each other rather than closer together.  Trade negotiations are not for the faint-hearted - naturally enough, everyone is looking after their own interests. Some sectors of the economy would do well but others with less political clout might suffer. The fishing industry (which represents only about 0.1% of the UK economy) is fearful of this because it knows trade deals involve trade-offs. One other thing: as well as negotiating with the EU, the UK would also need to sign up to a series of trade agreements round the world to replace those it has as part of the EU. All of that could take up most of the next decade. It won't be done when the UK leaves the EU - it will only just have begun. If the UK were to leave with no withdrawal agreement, of course, there would be no transition period. Supporters of no-deal call it a clean break - we've looked at what that would entail here.The UK would certainly be free of EU rules and regulations straight away. But it would be a sudden jolt that government forecasts and the vast majority of independent economists say would do serious damage to the economy. All those negotiations about the future would still have to take place but they would do so in a much less harmonious political atmosphere. And if the government sticks with its pledge to rule out any extension to the transition period, its opponents fear a new kind of no-deal could happen at the end of next year - ending the transition without any free trade deal in place.  Talking of harmony, part of the government's ""Get Brexit done,"" argument is it would help heal the divisions in society that have emerged since the Brexit referendum.But many people are opposed to the government's proposed Brexit deal. Those who support remaining in the EU would continue to campaign for another referendum - a final say before Brexit happens. And if they were to fail, they could transform their campaign into a movement to try to rejoin. On the other side of the argument, those who favour a clean break could continue to argue that the compromises the government has had to make to come to an agreement with the EU amount to a betrayal of their Brexit vision. Leave and Remain has become a more important dividing line in many ways than UK party politics and it doesn't feel like that will suddenly come to an end. Whatever happens in the next few months, the fallout from the Brexit referendum will remain with us for years to come.     What claims do you want BBC Reality Check to investigate? Get in touchRead more from Reality CheckFollow us on Twitter"
Guide to the parties 2019,https://www.bbc.com/news/election-2019-50420500,How much do you know about the parties fielding candidates in the general election? Here are our guides:You can see a full list of the parties taking part here.
PM hails Nato 'solidarity' after anniversary talks,https://www.bbc.com/news/election-2019-50653296,"Boris Johnson has hailed Nato as ""the most successful alliance in history"" after talks with leaders near London. The PM insisted there was ""very great solidarity"" within the alliance, amid tensions on its 70th anniversary. He also praised the role of the United States, adding the country had been a ""pillar of stability"" on security issues. Jeremy Corbyn said he wanted to ensure Nato focused on reducing ""tensions around the world"". Leaders of the 29-member military alliance have been discussing shared security issues at a special meeting to mark 70 years since its formation. In a statement issued after talks at a luxury resort near Watford, leaders acknowledged the ""challenges"" posed by China and Russia, and pledged to take ""stronger action"" against terrorism.On Tuesday, Nato Secretary General Jens Stoltenberg said countries in the alliance had added $130bn (£100bn) to defence budgets since 2016, and that this number would increase to $400bn by 2024. US President Donald Trump has frequently criticised how much other allies spend on defence.Speaking to reporters at a press conference afterwards, Mr Johnson said member countries were making ""real progress"" towards meeting a target to spend 2% or more of their economic output on defence.Asked whether President Trump was good for the UK, the prime minister said the US had always ""should shoulder to shoulder"" with the country.He added that the country's response after the Salisbury poisonings last year had been a ""fantastic testament to the transatlantic alliance"".Pressed directly to comment on Mr Trump as a leader, Mr Johnson said the administration he leads ""could not have been more supportive"".Labour leader Jeremy Corbyn said his party was committed to remaining part of the Nato alliance, adding it was ""important to be part of"".""I think we'll have to contribute to world peace through Nato and any other alliance, principally through the United Nations,"" he added. Although Labour's manifesto pledges to maintain the UK's commitment to Nato, Mr Johnson accused Labour of wanting to ""destroy"" it. Mr Corbyn has previously attacked the organisation ""as a danger to peace"", but on Wednesday said: ""We have decided we'll remain in Nato as a party, and that's it.""He added that he thought Nato was going in the ""wrong"" direction back in 2011, but the alliance has since ""changed its focus"". On Tuesday evening, leaders attended receptions at Downing Street and at Buckingham Palace.The prime minister held talks with German Chancellor Angela Merkel, French President Emmanuel Macron and Turkish President Recep Tayyip Erdogan to discuss Syria, Libya and counter-terrorism at No 10.He had faced questions over whether he was avoiding a one-to-one meeting with Mr Trump, over concerns it could blow his election campaign off course, but Downing Street said the two men had a low-key, off camera meeting.On Wednesday, Mr Johnson said he had not talked about the NHS during the meeting, but did talk about ""all manner of areas of cooperation, from Nato to Syria to trade"". Labour has claimed throughout the election campaign that the future of the health service could be threatened by a post-Brexit trade deal with the US.  Later in the evening, Mr Johnson was filmed chatting with a group of leaders during a reception at Buckingham Palace - they appeared to be discussing the US president.Mr Johnson said it was ""complete nonsense"" to suggest he did not take Donald Trump seriously after the video emerged.President Trump has cancelled a planned press conference, telling reporters: ""We'll go directly back. I think we've done plenty of news conferences.""Labour leader Jeremy Corbyn - who said he intended to ask the US president for ""reassurances"" that the NHS would be ""off the table"" in post-Brexit trade talks - was also at the reception, but says he did not have an opportunity to speak to him.Speaking at a press conference earlier in the day, Mr Trump had said he wanted ""absolutely nothing to do with"" the NHS, adding he would not touch it even if it was handed to his administration ""on a silver platter"".Asked whether he could work with Mr Corbyn as prime minister, he said he could ""work with anybody"", although earlier he said he thought Mr Johnson would do a ""good job""."
