Title,Link,Article
Nigel Farage's interview fact-checked,https://www.bbc.com/news/election-2019-50676321,"The Brexit Party leader Nigel Farage was the fourth party leader to be interviewed by the BBC's Andrew Neil in this election campaign. They covered a number of topics, including immigration and the NHS, life after Brexit and the impact of his previous party, UKIP. BBC Reality Check looked at four of his claims.Reality Check: Nigel Farage is correct that the UK population has increased by about 8 million since 1997, to about 66 million, according to the Office for National Statistics.Reality Check: Nigel Farage made this claim in response to Andrew Neil's questions about how he'd fill vacancies in the NHS and social care, if there were controls, after Brexit, on EU migrants coming to the UK to work. Mr Farage said, in fact, immigration had put a ""massive burden"" on the health service.So, what does the evidence show? The Migration Advisory Committee, an independent public body that advises the government, looked at this as part of its report into the effects of immigration from the European Economic Area (EEA).It found that migrants from Europe ""contribute much more to the health service and the provision of social care in financial resources and through work than they consume in services."" It said migrants from the EEA tend to be younger and healthier than the UK-born population, and consume fewer NHS services than them.  It found ""no evidence that migration has reduced the quality of healthcare.""According to the Health Foundation 13.3% of the entire workforce of NHS staff in England, and 28.4% of doctors, are from outside the UK (both EU and non-EU). Reality Check: Nigel Farage said: ""Just take Article 77 of the political declaration, it says on everything, even taxation, we'd be tied to EU rules."" Mr Farage was taking issue here with parts of the Political Declaration - it's the document that sits alongside Boris Johnson's Brexit deal.It sets out a framework for the relationship between the UK and the EU after Brexit but is not legally binding. Article 77 pledges that the two parties will create a ""level playing field"", by upholding current standards in ""areas of state aid, competition, social and employment standards, environment, climate change, and relevant tax matters"".The intention is to prevent UK companies from out-competing European rivals by adopting weaker standards on areas like employment, or by receiving unfair government subsidies.While there is no legal obligation to follow the Political Declaration, the EU would be likely to restrict the UK's access to the single market if it tried to drastically undercut European standards.The 2018 Withdrawal Agreement (known as Theresa May's deal) had an extensive list of binding level playing field provisions, on issues such as taxation and labour standards. These were removed from the revised version (Boris Johnson's deal).Reality Check: Nigel Farage said: ""We took far more Labour votes in the key seats in the Midlands in that campaign and actually the Conservatives got a majority because of us.""Mr Farage, who led UKIP at the time, has claimed credit for David Cameron's victory in 2015 before.He argues that former Labour supporters voting for UKIP helped to give the Conservatives victory in marginal seats, especially in the Midlands and the north of England.It's impossible to know for sure how people would have voted if UKIP hadn't stood but recent research for the authoritative British Election Survey raises some evidence that might question this claim.Their research found that in 2015, UKIP drew about a third of its support from the Conservatives, more than it did from Labour. The authors conclude that ""our evidence shows that UKIP hurt the Conservatives in 2015"". In defence of Mr Farage's claim, the Brexit Party directed us to a 2015 study by Professor Matthew Goodwin of the University of Kent, which found that the impact of UKIP in Conservative seats was ""far more modest"" than in Labour seats.What claims do you want BBC Reality Check to investigate? Get in touchRead more from Reality CheckFollow us on Twitter"
When wanting to vote could put you at risk,https://www.bbc.com/news/uk-politics-50562323,"When you register to vote, your name and address are automatically placed on the electoral roll - a public document available to all. For some, that can lead to a potentially dangerous dilemma.""If I were being really cynical about it, one could argue that it's almost sexual discrimination by the back door,"" says a women we'll call Kate, as we talk about her struggle to access the vote after escaping an abusive relationship, with the two small boys.Kate was always politically engaged. She had been registered to vote by post at her previous address - but it was too dangerous for her to return there to pick up her ballot paper and she couldn't make her new address public for fear her abusive partner could catch up with her.But she still wanted to vote. So she began researching her options. Initially, she found nothing online to help her. Eventually, her mother suggested asking her local council.""The first person she spoke to said she had no idea what my mother was talking about but when pressed did find a senior officer,"" Kate says.""This officer knew that I could register anonymously and checked my current address and advised there was a special form that would be posted to me."" It was the first time Kate had heard of the system. It seems many others don't know it exists. Data from the Office for National Statistics shows 2,268 people in England and Wales registered anonymously in 2016 - rising to 2,525 in 2017, the year of the last general election. But Women's Aid says more than 13,000 women in England were taken into emergency or refuge accommodation in 2016-17.""That is obviously a very small fraction of survivors who had successfully used the anonymous registration system,"" Lucy Hadley, the charity's campaigns and public affairs manager, says. And even after having discovered the option to register anonymously, Kate still had to jump through ""many hoops"". People can apply for anonymous registration only if they have certain documents - such as a court injunction or a letter asserting they would be at risk if their address was publicly available.Previously, these could be issued only by senior figures in crime prevention and social services. But following pressure from a campaign by women's organisations, the list of people who can provide such a letter was last year expanded to include managers at refuges, police inspectors, and registered nurses or GPs. ""My particular court order was not included,"" Kate says. ""It was like another barrier going up. In a situation such as mine - and I'm certainly not unique - there is so much going what with different social services and the courts that having to fight to vote is probably not up there on most people's top 10 to do list.""But Kate was told she could ask her GP. ""I seem to be always up there with tiny children, so I asked there,"" she says. She worried there would be a fee but wasn't charged. ""I got the form to the town hall in time so I am now in the system,"" she says. While she welcomes the recent changes that allow more people to provide evidence, Ms Hadley says more needs to be done to help women like Kate.Most people have to register to vote once only. They will have to re-register after moving house and local councils are likely to check the electoral roll is still correct every year.However, under the current system, anonymous registration lasts a year only. Those registered have to re-apply - and gather all the evidence again - every time they want to vote in an election. According to Ms Hadley, the government says the system is designed to protect those whose safety is ""currently at risk"". But Women's Aid is calling for the 12-month limit to be scrapped.""We are concerned that many survivors will continue to face barriers to voting because they cannot 'evidence' that their current safety is at risk,"" Ms Hadley says.""Domestic abuse does not end when a relationship ends.""We know professionals' understanding of post-separation abuse, and the continued harm women suffer after leaving, can be poor - therefore it may be challenging for survivors to keep accessing an 'attestation' from a professional for anonymous registration after the relationship has ended.""Here's a concise guide to where the parties stand on key issues like Brexit, education and the NHS. "
Who should I vote for? Election 2019 manifesto guide,https://www.bbc.com/news/election-2019-50291676,"The UK's main parties are announcing their campaign promises ahead of a general election on 12 December. To help you decide who you might vote for, use this guide to compare where the parties stand on the key issues.This guide is updated when each party's manifesto is published. A manifesto is the full list of official pledges parties make to voters, explaining what they would do if elected. If you cannot see this interactive click or tap here.So far, the Conservatives, Labour, the Lib Dems, the Independent Group for Change, the Green Party, the Brexit Party and UKIP have revealed their manifestos for England and, in some policy areas, the UK.In Scotland, the SNP, the Scottish Conservatives, Scottish Labour, the Scottish Lib Dems and the Scottish Greens have launched, and in Wales, Plaid Cymru, the Conservatives, Labour and the Brexit Party have revealed their pledges.In Northern Ireland, the Alliance, the DUP and Sinn Fein have unveiled manifestos so far.The issue areas in the guide are based on those highlighted in Ipsos Mori's Issues Index, which measures the issues the public believe to be the most important facing the country.More information on how the issues and parties were selected is in our methodology.You can also see a full list of parties standing at the general election."
Terror attack survivors demand more support,https://www.bbc.com/news/election-2019-50628121,"More than 70 terror attack survivors have demanded that all political parties agree a ""charter"" protecting their wellbeing after the election.They want quicker access to mental health support and faster compensation.The group, which includes survivors of the 2017 Manchester Arena bombing and attacks in London, also says all venues must set up anti-terror security plans.Its demands follow Friday's London Bridge attack, in which two people were stabbed to death.Jack Merritt, 25, and Saskia Jones, 23, are being honoured in a remembrance service at Guildhall Yard in the City of London on Monday.Boris Johnson launched an urgent review after it emerged that convicted terrorist Usman Khan - who was shot dead by police following Friday's attack - had been released having served half his sentence.The prime minister blamed legislation introduced when Labour was in power and said there were currently 74 people convicted of terrorist offences who had been released early.But Labour leader Jeremy Corbyn accused the Conservatives of trying to keep people safe ""on the cheap"" and called for more funding for public services, including probation and mental health.The survivors' group, which has written to the Daily Telegraph outlining its demands, includes Brendan Cox, whose wife the Labour MP Jo Cox was killed in 2016 and Gina Van Dort, whose husband Chris Dyer died in the Tunisia attack in 2015, in which 30 Britons were murdered.Its letter says: ""We are sick of the promises [made by politicians] that never materialise. The promises to look after victims who then face months of delay for mental health support or years of waiting for compensation.""We ask all of the parties to agree to consult on and implement a new 'Survivors' Charter' that would guarantee basic rights and services for survivors.""The group wants MPs to back ""Martyn's Law"", compelling all owners of events spaces to have in place a ""basic security plan"". This is named after Martyn Hett, killed in the Manchester Arena bombing in May 2017, in which 22 people were killed.The group says it is ""sick of promises that never materialise"" but praises the ""heroes"" who confronted Khan on London Bridge, preventing him from continuing his attack.It also asks the public not to ""give the terrorists what they want by sharing videos or views from attackers or by blaming whole groups or giving in to hate"".And it wants the media to ""allow survivors the space to recover after terrorist incidents and to focus coverage on the heroes rather than the attackers"".Three people were injured in Friday's attack, which Khan began at a prisoner rehabilitation conference, organised by Cambridge University, at Fishmongers' Hall, next to London Bridge.Two of the injured remain in hospital and are described as being in a stable condition."
Where do the parties stand on Brexit?,https://www.bbc.com/news/uk-politics-48027580,"The government's Brexit legislation is on hold as the UK gears up for the general election on 12 December.But where do the parties stand on Brexit?Prime Minister Boris Johnson wants the UK to leave the European Union (EU) with the revised deal he agreed.He says that with a majority Conservative government, he would start the process to ""get Brexit done"" on day one of the new Parliament.He previously said the UK would leave on 31 October ""do or die"". However, Mr Johnson was forced to write a Brexit extension letter to the EU, after MPs failed to approve his revised deal.Mr Johnson secured changes to the deal previously negotiated by Theresa May. It includes scrapping the controversial Irish backstop and replacing it with a new customs arrangement.Brexit left the Conservative Party heavily divided, with 21 MPs expelled for failing to follow the government's line. Ten were later welcomed back.If it wins the election, Labour wants to renegotiate Mr Johnson's Brexit deal and put it to another public vote. It says it will achieve this within six months.Labour says its referendum would be a choice between a ""sensible"" Leave option versus Remain. Under its Leave option, Labour says it will negotiate for the UK to remain in an EU customs union, and retain a ""close"" single market relationship.This would allow the UK to continue trading with the EU without checks, but it would prevent it from striking its own trade deals with other countries. If a referendum was held, Mr Corbyn has said he would remain neutral if he was prime minister ""so I can credibly carry out the results"".Just like the Conservatives, Labour has had to deal with internal divisions over its Brexit policy. More than 25 Labour MPs wrote to Mr Corbyn in June, saying another public vote would be ""toxic to our bedrock Labour voters"".While Labour's election strategy early on was to emphasise that the vote was about more than Brexit, it is changing its focus.The message now is that Labour's leadership is not opposing Brexit by opposing Mr Johnson's deal - it wants to find what it believes is a better one.The SNP is pro-Remain and wants the UK to stay a member of the EU. It has been campaigning for another referendum on Brexit. Alternatively, it wants Article 50 revoked if it is the only alternative to a no-deal Brexit.The SNP's ultimate objective is for an independent Scotland that is a full member of the EU.The Liberal Democrats have pledged to cancel Brexit if they win power at the general election.The policy was endorsed in September by party members at the Lib Dem party conference. If the Lib Dems do not win a majority, they would support another referendum.Leader Jo Swinson says that stopping Brexit would free up £50bn, over five years, to spend on public services.She says that so-called ""Remain bonus"" would pay for 20,000 new teachers, extra money for schools and to help support low-paid workers.The Democratic Unionist Party (DUP) had an agreement with the Conservatives whereby it lent it support in the Commons during the last Parliament. However, while the DUP wants the UK to leave the EU, it opposes elements of Mr Johnson's Brexit deal which relate to Northern Ireland,.At its manifesto launch, the party said it will seek further changes to the deal if he is still prime minister after the election.The deal includes special arrangements for Northern Ireland. One gives the Northern Ireland Assembly a majority vote on how customs arrangements would work after Brexit.The DUP wants such a vote to be taken on a cross-community basis, rather than a straight majority.This party is made up of MPs who left the Conservatives and Labour, in part because of their positions on Brexit.It backs another referendum, or ""People's Vote"", and wants the UK to remain in the EU.The party backs remaining in the EU, despite Wales voting Leave in the referendum. It wants a further referendum and to Remain.In a bid to get as many pro-Remain MPs as possible into Parliament, Plaid Cymru, the Liberal Democrats and Greens have agreed an electoral pact in 11 of the 40 seats in Wales.The party's one MP, Caroline Lucas, has been a vocal campaigner for another referendum, and believes the UK should stay in the EU.The Brexit Party wants the UK to leave the EU without a deal, in what it calls a ""clean-break Brexit"".It says that is the way to ""start changing Britain for good from day one"" and that the transition period after leaving would not be extended. It also says Mr Johnson's revised Brexit plan is a bad deal.Brexit - British exit - refers to the UK leaving the EU. A public vote was held in June 2016, to decide whether the UK should leave or remain.More news explainers"
Tories take Blyth Valley from Labour in shock win,https://www.bbc.com/news/election-2019-50767123,"The Conservatives have taken Blyth Valley which has been Labour since it was created in 1950, in the first shock result of the general election.   Ian Levy got 17,440 votes, beating the Labour candidate by more than 700 votes.Labour has held on to all the other declared seats in the region, but in all cases with a reduced majority. In Wansbeck, Labour Party chairman Ian Lavery retained the seat but with his majority down from 10,435 to 814.It is the first time that Blyth Valley, a former mining area which voted Leave in the EU referendum, will have a Conservative MP.The constituency's former incumbent, Ronnie Campbell, stood down after more than 30 years.Speaking after the result, Mr Levy thanked his team, his wife, the people of Blyth Valley and Boris Johnson.""This is a huge responsibility I have taken on,"" he said.""I will be going to London on the train on Monday, we're going to get Brexit done and build a strong economy for the UK.""If you cannot see the graphic click hereNewcastle Central was the first seat in the UK to declare, with Labour's Chi Onwurah holding on to the seat.Labour also held on to Newcastle East, Newcastle North, South Shields, Washington and Sunderland West, Jarrow, Gateshead, and Houghton and Sunderland South.In Wansbeck - which was held by Labour chairman Mr Lavery - there was an 11.6% swing from Labour to the Conservatives.Bridget Phillipson was returned for Houghton and Sunderland South with a majority down from 12,341 in 2017 to 3,115.""The Labour Party was founded to advance the interests of working people and we are failing in that mission if we don't secure the confidence of enough working people in the country to form a government,"" she said.Extraordinary 10% swing from Labour to Tory in Blyth Valley. White working class voters desert the party many have supported all their lives (apologies for stray ‘e’ earlier)End of Twitter post  by @bbcnickrobinsonJulie Elliott, who retained Sunderland Central but with a 2017 majority of 9,997 reduced to 2,964, said Labour had ""let the country down by not being good enough to win against this awful Tory government"".""People on the doorstep have repeatedly said to me they cannot vote for this party,"" she said.""They will come back to us if we become a radical party for change on the centre-left ground which is where we win elections."""
'I killed the Lib Dems and hurt Labour' - Farage,https://www.bbc.com/news/election-2019-50766123,"The Brexit Party has ""killed the Liberal Democrats and hurt the Labour Party"", Nigel Farage has claimed.A BBC, ITV and Sky News exit poll suggests the Conservatives will win 368 MPs in the 2019 general election - 50 more than at the 2017 election.Labour is expected to win 191 seats and the Lib Dems gain one to have 13. The Brexit Party looks unlikely to get any.But Mr Farage said he was happy with his ""influence"", and that his party had killed off hopes of another referendum.Speaking to the BBC after the announcement of the exit poll results, he said the Conservatives would win or come close in dozens of seats where they otherwise would not have done without the Brexit Party taking thousands of votes (from their opponents).He added: ""I killed the Liberal Democrats and I hurt the Labour Party.""If you cannot see the lookup tool, click here.Counting is under way in most of the UK's 650 constituencies. A handful of results were declared before midnight. The rest will come in the early hours and a final result is expected by Friday lunchtime.The exit poll - conducted by Ipsos Mori at 144 polling stations, with 22,790 interviews - suggests the Conservatives will win an overall majority of 86But Mr Farage claimed that majority would not exist if his party had not withdrawn 317 candidates from Conservative held seats.""I can tell you that if we had stood in every seat in the country it would have been a hung Parliament,"" he said. ""That would have been a disaster.""He added: ""I was determined, in this election, we would use our influence to stop a second referendum. That overwhelmingly was behind our decision to stand down in 317 seats.""Jo Swinson herself said that effectively poleaxed her campaign. And then taking the fight to Labour was important.He added: ""Would I like to have won a few seats? Yes of course.""Born out of frustration with delays to the UK's departure from the EU, the Brexit Party was launched in April 2019, with ex-UKIP leader Mr Farage leading it.When asked if the Brexit Party was now ""finished"", Mr Farage said: ""We've used our influence, that's the important thing. If we get Brexit... we've done a good job.""Arron Banks, who campaigned to leave the European Union alongside Mr Farage, said the exit poll suggested a ""brilliant victory"" for Boris Johnson, who now had a ""strong majority"" to negotiate a free trade deal with the EU.He added that while the Brexit Party was now ""over"", the ""pressure"" applied to the Tories had helped return them to their ""roots"".""We set out to make the Conservative Party conservative again - and it's job done,"" he said."
