Title,Link,Article
Sir John Curtice: Why age not class matters most,https://www.bbc.com/news/election-2019-50543903,"Fifty years ago, the way people voted in the UK was largely determined by social class, but different influences are at play in the 21st Century.Back in the 1960s, political scientist Peter Pulzer famously stated that ""class is the basis of British party politics; all else is embellishment and detail"". People in middle-class jobs were more likely to vote Conservative, and the working class were more inclined to vote Labour. Any other differences were relatively unimportant.The picture is now very different. The kind of job that someone does is expected to make very little difference to how they will vote at this election. On the other hand, whether they are young or old may matter a great deal.    Polling companies divide voters into ABC1s (those employed in middle-class ""white collar"" jobs) and C2DEs (those in a working-class ""blue collar"" occupation). These two groups differ little in how they propose to vote at this election.     At 42%, support for the Conservatives is the same in both, while at 33%, support for Labour - a party originally founded to advance the interests of the working class - is only five points higher among the working class than the middle class.(The polls are GB-wide. Because of this, they cannot tell you anything meaningful about the demographic variation on the votes for SNP and Plaid Cymru).This trend has been in evidence for some time. At each of the last three elections, the Conservatives have advanced more strongly than Labour among working-class voters. In the last election, the difference between the two groups had become quite small. This election looks set to repeat that pattern.Conversely, the Liberal Democrats used to pride themselves on attracting support from both sides of the class divide. That claim is now more difficult to sustain. At 19%, the party's support among middle-class voters is markedly higher than among working-class supporters (10%). Also striking, however, is the strength of support for the Lib Dems among graduates. On average, support is some 14 points higher among those with a degree than among those without. This reflects the fact that nearly all Lib Dem supporters voted Remain in the EU referendum, and that, in turn, university graduates are especially likely to back staying in the EU. Support for the Conservatives is higher among those without a degree than among graduates - as might be expected, given that most of the party's support comes from those who voted Leave. This, in turn, helps explain why the party is no longer more popular among middle-class voters than those in working-class occupations.However, if voting no longer differs much between working-class and middle-class voters, it does differ between other groups.More like thisMen and women vote a little differently.  At present the Conservatives are 15 points ahead of Labour among men, but by 11 points among women. According to Ipsos Mori, such a pattern - with Labour performing a little more strongly among women than men - has been in evidence since the 2005 election. A much bigger difference is to be observed between those from different ethnic backgrounds. In contrast to the position in the polls in general, Labour are well ahead among those from a black, Asian or other minority ethnic (BAME) background. According to ICM, 56% of BAME voters intend to vote for Labour, while only 23% are likely to support the Conservatives. BMG puts the figures at 40% and 27% respectively.The most striking difference of all is between younger and older voters. About three-fifths of those aged 65 or older are currently proposing to vote Conservative, compared with less than a quarter of those aged under 35. Conversely, nearly half of those aged less than 35 are backing Labour - but only 17% of those aged 65 or over.There has always been a tendency for the Conservatives to be favoured in greater numbers by older rather than younger voters, with the opposite being true for Labour. Nevertheless, the gap widened noticeably in the 2015 election and even more so in 2017. It looks as though the generational gap could be just as big this time.Younger and older voters also disagree about Brexit. Younger voters are more likely to have voted Remain and older ones for Leave. This helps explain why younger voters are less willing to vote Conservative. However, the generational gap was widening before the EU referendum was held, so it must be about more than Brexit.Some other generational differences in the UK may be playing a role, such as attitudes towards immigration, ease of getting on the housing ladder, and the cost of university tuition.Either way, it is clear that age, not social class, is the division that nowadays lies at the heart of British party politics and will play a significant role on 12 December.  About this pieceThis analysis piece was commissioned by the BBC from an expert working for an outside organisation.Sir John Curtice is professor of politics, Strathclyde University, and senior research fellow at NatCen Social Research and The UK in a Changing Europe. This piece uses Opinium polling on the leaders of the parties competing in the general election across the UK. Comparable results for parties with candidates in individual nations, including the SNP, are not available.Edited by Ben Milne"
Check the exit poll forecast for your area,https://www.bbc.com/news/election-2019-50424263,"The Conservatives are forecast to have a majority in Parliament, according to an exit poll published as voting in the 2019 general election ends.The exit poll, carried out by Ipsos MORI for the BBC, ITV News and Sky News, suggests the Tories may win 368 seats and Labour 191.The SNP is forecast to win 55 seats, the Liberal Democrats 13, Plaid Cymru three and the Green Party one. The Brexit Party is not forecast to win any seats, Enter your postcode to find out what the exit poll currently forecasts for your constituency. This may change as results come in and the forecast is updated.If you can't see the exit poll search box, tap here.The exit poll is a way of forecasting what may happen in the general election, after voting ends but before the results are known.Researchers at 144 polling stations across England, Scotland and Wales ask people to indicate which way they voted. Scotland has only 12 sampling points so the exit poll here is harder to forecast than in other parts of the country. A team of academics led by Sir John Curtice, professor of politics at Strathclyde University, use this and other data to estimate the vote share per party in each constituency and then to forecast each party's likelihood of winning in any given seat.All those individual probabilities are added together to arrive at the forecast seat totals for each party. The model is updated throughout the night as results come in, so seat totals and individual constituencies are likely to change.Updated 23:29PMTotal predicted seatsSource: Ipsos MORI for BBC / ITV News / Sky NewsThe constituency search and seat-by-seat list show exit poll forecasts for individual constituencies, apart from those in Northern Ireland.If the chance of the forecast outcome in a seat is 95% or higher, it is shown as a ""likely"" outcome. If it is between 80% and 94%, it's a ""possible"" outcome.Seats where the probability for any particular party winning is lower than 80% are shown as ""too close to forecast"".The exit poll gives an indication of what may happen but, of course, the real result in each seat isn't known until the official declaration - at which point the information here will update when you refresh the page.
        Explore the exit poll forecasts for every constituency in Great Britain. Refresh the page to see updates as results come in.
    Javascript disabledYou can currently only view the ten most marginal predictions and/or results. Please enable Javascript in your browser to see the full list and filter options.  Fife North East    Fife North East    Likely Scottish National Party hold    99+% chance    Perth & Perthshire North    Perth & Perthshire North    Too close to forecast winning party    54% chance of Scottish National Party hold, 46% chance of Conservative gain    Kensington    Kensington    Likely Labour hold    97% chance    3% chance of Conservative gain from Labour    Dudley North    Dudley North    Likely Conservative gain from Labour    99+% chance    Southampton Itchen    Southampton Itchen    Likely Conservative hold    99+% chance    Newcastle-under-Lyme    Newcastle-under-Lyme    Likely Conservative gain from Labour    99+% chance    Richmond Park    Richmond Park    Likely Liberal Democrat gain from Conservative    99+% chance    Crewe & Nantwich    Crewe & Nantwich    Likely Conservative gain from Labour    99+% chance    Glasgow South West    Glasgow South West    Likely Scottish National Party hold    99+% chance    Glasgow East    Glasgow East    Likely Scottish National Party hold    99+% chance  
        Sorry, we couldn’t find any matching results. Please try a different filter.
    Counting all the seats predicted for a particular party in the seat-by-seat view is unlikely to match the total for that party in the current forecast section.This is because the seat totals are calculated by adding up the probabilities for that party, not by counting the number of predicted constituency wins. Seats categorised as ""too close to forecast"" are not assigned to a party in the seat-by-seat view.How accurate is the exit poll?University of Warwick exit poll explainerProduced by Christine Jeavans, design by Natalie Smart, development by Marcos Gurgel and Scott Jarvis."
Johnson and Corbyn clash over Brexit in BBC debate,https://www.bbc.com/news/election-2019-50681321,"Boris Johnson and Jeremy Corbyn clashed over Brexit in the final head-to-head debate before the 12 December election.During the live debate, Mr Corbyn said Labour would bring Brexit ""to an end"" by negotiating a new deal and putting it back to the public in a referendum, alongside a Remain option.Mr Johnson said he had ""a wonderful deal"", and would use it to take the UK out of the EU on 31 January.Other topics covered included the NHS, security and Northern Ireland.Early on in the debate - hosted by Today presenter Nick Robinson - the Labour leader said he would negotiate a new withdrawal agreement with the EU within three months before putting it to a final say referendum - alongside Remain - within six months.The prime minister countered by saying he already had a withdrawal agreement in place, and would use it to leave the EU next month if he won a working majority in Parliament.But Nick Robinson challenged Mr Johnson, pointing out that while he had a withdrawal deal in place, he did not have a trade deal with the EU, and so could not rule out a no-deal exit in January 2021.Coming into the event, Labour and the Conservatives had spent the day arguing over how Mr Johnson's Brexit deal might affect Northern Ireland.Labour said a leaked document showed Mr Johnson's agreement would have a ""devastating"" impact on Northern Ireland.When the subject arose in the debate, Mr Corbyn said of his rival: ""He spoke at a DUP conference and said there would be no [trade] restrictions [after Brexit] whatsoever, we now know there are restrictions.""But Mr Johnson was met with applause from the audience when he said he found it ""slightly curious"" to be lectured about the union by Mr Corbyn, referring to the Labour leader's past support for those who want to see a united Ireland.Like Brexit, the NHS has featured heavily in the campaign so far - and Friday's debate was no different.Faith, a student nurse in the audience, asked how each leader would deal with a shortage of NHS nurses.The Conservative leader said a government run by him would ""encourage nurses overseas to come"" to the UK ""by shortening the time for their visa applications"" and by reintroducing bursaries for training.Mr Corbyn described the NHS as at ""breaking point"", adding that, under a Labour government, ""£40bn in total would go into the NHS in order to fund it properly"".The Labour leader also repeated one of his main attack lines of the campaign - that a Tory government would allow the NHS to form part of a future trade deal with the US. However, Mr Johnson described that claim as ""Bermuda Triangle stuff"".Responding to the performances of Mr Corbyn and Mr Johnson, SNP leader Nicola Sturgeon tweeted: ""That was utterly woeful. Two uninspiring men, both of them unsuited to be PM."" Meanwhile, Amelia Womack, of the Green Party, told the BBC: ""I find it frustrating, as a younger woman, that we weren't discussing things that are relevant to my generation - whether that's house prices, rental prices, freedom of movement across Europe, or even zero-hour contracts.""Plaid Cymru's Liz Saville Roberts said the debate felt like a ""shoddy end-of-term pantomime"", and said both men displayed a ""lack of honesty"". She added that, contrary to the claims of Mr Johnson, the ""chaos"" of Brexit ""is going to go on"", even if the UK leaves the EU next month.And the Liberal Democrat Brexit spokesman Tom Brake said: ""Tonight's debate was British politics at its worst. Two leaders offering nothing new, nothing different and neither being honest about the pain Brexit will cause our communities.""The prime minister and Mr Corbyn were also asked about security - an issue that has risen to prominence since the London Bridge attack on 29 November.Both candidates were asked by an audience member if they would prioritise the safety of citizens over human rights.Mr Corbyn said the choice was ""not an either/or"". He added the UK could not have security ""on the cheap"", and so Labour would ""back the police up"" with an increase in officer numbers.When it came to his turn, Mr Johnson referred to the London Bridge attack, and said it was ""extraordinary and wrong"" that the attacker was given automatic early release from prison after an earlier terrorism conviction.In a campaign where both parties have sought to repeatedly talk about their key themes, tonight did not diverge radically from the script.Boris Johnson came under pressure on the issue of trust - and whether his Brexit plan would mean checks between Great Britain and Northern Ireland. Jeremy Corbyn was once again pressed on his failure to pick a side on Brexit - and questioned on why Europe would offer Labour a new deal when so many frontbenchers back Remain.Both men landed punches. But none of them were critical. And given that polls suggest the Conservatives are ahead in the polls - that might suit Boris Johnson more than Jeremy Corbyn. Here's a concise guide to where the parties stand on key issues like Brexit, education and the NHS. "
Labour pledges to cut rail fares by a third,https://www.bbc.com/news/business-50621621,"Labour has announced plans to slash rail fares by 33% and simplify ticket prices for part-time workers if it wins the election on 12 December.The party also wants to make train travel free for young people under the age of 16 and build a central online booking portal with no booking fees.The proposal is part of broader plans by the party to nationalise the UK's train system.Conservative Transport Secretary Grant Shapps said the plan was ""desperate"".The Conservatives and Liberal Democrats have also pledged to improve transport. Labour said privatisation had ""created one of the most expensive ticketing systems in the world"", which discriminated against part-time workers, discouraged rail travel and excluded the young and low-paid.Andy McDonald, Labour's shadow transport secretary, told the BBC's Today programme: ""[Our pledge] is much overdue given that passengers have had to suffer rises amounting to about 40% since 2010.""And if we really want to make the shifts that we need to get people from cars into public transport this is a major contribution to it, because obviously that's critical to addressing the climate change crisis.""Labour's manifesto contained a pledge to make rail travel cheaper but no details about what that would entail. The party said the proposal to slash fares by a third would cost £1.5bn per year and be covered by Vehicle Excise Duty - money the Conservatives have earmarked for roads.More generally, Labour says nationalisation - which it plans to achieve within five years of coming to power - will allow fares to be capped and improve the reliability of services.The Conservatives' Mr Shapps said: ""This is another desperate attempt from Labour to distract from their inability and unwillingness to be straight with people on where they stand on Brexit, and the fact they would raise taxes on low and middle-income workers across the country.""You simply cannot trust [Jeremy] Corbyn to deliver what he claims. His ideological plans would wreck our economy, cost people their livelihoods and with the help of Nicola Sturgeon, would waste the whole of next year on two more chaotic referendums.""In keeping with their proposals to nationalise the railways, Labour's plans to significantly cut fares would see a reverse in the direction of travel for policies on train fares since privatisation.Since 1995, successive governments have tried to move the day-to-day cost of running the railways onto fare-payers and away from the taxpayer. At that time, it used to be split 50/50 - now it's more like 75% on the shoulders of the passenger. The argument goes that by raising fares in line with the Retail Prices Index inflation figure each year, government spending on the railways can be reserved for investment in infrastructure. Announced just two days after the average train fare rise of 2.7% was published, and coinciding with major industrial action on several lines in the run-up to Christmas, Labour's proposal for a significant cut to fares could prove popular with commuters.The future of ticketing and rail fares is just one of the issues being looked at by a major review into the UK's railways due to report after the election.It is led by Keith Williams, the former boss of British Airways, who is particularly interested in how innovation in aviation fares and ticketing could be applied to the railways.Meanwhile, the Liberal Democrats have pledged to freeze peak-time and season ticket train fares for the next five years and cancel the 2.7% rise in rail tickets from 2 January 2020. They also plan to complete the HS2 high-speed rail link.And the Conservatives are pledging to improve transport links as part of a £3.6m Towns Fund.They have also promised to give more funding to local combined authorities to improve bus and train services and put £500m into reversing cuts to the railway network made in the 1960s.The Brexit Party's flagship transport policy is scrapping the HS2 rail project - a goal it shares with the Green Party.Regulated fares include season tickets for most commuter journeys, as well as saver returns, standard returns and off-peak fares between major cities. They make up about 45% of all fares. The average change in these figures is capped at July's Retail Prices Index (RPI) measure. They are due to rise 2.8% in January.Across England, Wales and Scotland regulated fares raised about £3.3bn for the rail operators, according to the Office of Rail and Road.Labour says they will pay for this by ring-fencing income from Vehicle Excise Duty, which the Conservatives plan to allocate to a special road-building fund from 2020-21 onwards.So, an interesting question will be which road projects will be defunded to pay for this pledge."
Sir John Curtice: Has this been a Brexit campaign?,https://www.bbc.com/news/election-2019-50659248,"Brexit triggered the general election, but is it still the most important issue for voters?The election campaign has now entered its final week. But what do voters say are the most important issues facing the country? And have their views on Brexit become more or less important in shaping how they are likely to vote? This graph shows how people respond now when asked which are the most important issues facing the country, and how this compares with the position at the beginning of the election campaign four weeks ago.All three of the featured polls report a five-point increase in those who mention health. Labour's emphasis on this issue seems to have made some impression on voters.The attention given by all of the parties to the issue of climate change seems to have resulted in an increase in concern about the environment, although it is still relatively low down in the pecking order. None of the other domestic issues appear to have become more important in voters' minds.Meanwhile, Brexit continues to be mentioned far more than any other issue apart from health. There has been no marked change in how important voters think it is.People's views on Brexit continue to be reflected strongly in how they propose to vote.This graph compares how Remain and Leave voters say they would currently vote, and how they said they would vote shortly after the election was called.There continues to be a sharp division between Remain and Leave voters.As many as 79% of Remain voters propose to vote for a party backing a second referendum. At the same time, about three in four (76%) of Leave voters say they will vote for a party in favour of Brexit.More like thisBoth numbers are similar to what they were four weeks ago.However, within both the Remain and Leave groups, there has been a significant change in how people say they will vote. Those who voted Leave have swung heavily towards the Conservatives - support for whom has increased by 12 points - while that for the Brexit Party has dropped by 14 points. Part of the reason, of course, is the Brexit Party's decision not to contest any seats being defended by the Conservatives.Meanwhile, Remain voter support for Labour has increased by five points, and dropped by six for the Lib Dems.In contrast, support for the Conservatives among Remain voters has hardly changed at all. The same can be said about the level of support for Labour among backers of Remain.  In short, most of the movement during the election campaign has consisted of voters shifting their choice from one pro-Brexit party to another, or from one pro-referendum party to another. Very few voters have crossed the Brexit divide.As a result, support for the Conservatives has become increasingly concentrated among those who voted Leave, while more of Labour's vote is now garnered from those who supported Remain.Brexit may not be the only issue in this election. But even at the beginning of the campaign it heavily shaped voters' choices, and it looks likely to do so in the final week of the campaign, as voters make up their minds. About this pieceThis analysis piece was commissioned by the BBC from an expert working for an outside organisation.Sir John Curtice is professor of politics, Strathclyde University, and senior research fellow at NatCen Social Research and The UK in a Changing Europe. Edited by Ben Milne "
Johnson backs tech tax despite Trump's threats,https://www.bbc.com/news/business-50656106,"Prime Minister Boris Johnson has said he would press ahead with a digital sales tax even after the US threatened to punish France for a similar move.In a proposal first outlined last year, large online companies face a tax of 2% of UK sales from April 2020.Mr Johnson said digital companies needed to make a ""fairer contribution"".Donald Trump has threatened to impose taxes on French goods in retaliation for a digital services tax that would affect Google, Amazon and Facebook. Ahead of Wednesday's Nato meeting in Watford, the US President said: ""We've taxed wine and we have other taxes scheduled.""We'd rather not do that, but that's the way it would work. So it's either going to work out, or we'll work out some mutually beneficial tax.""The US said it would apply tariffs of up to 100% on $2.4bn (£1.8bn) of cheese, Champagne, handbags and other French products. The US has made clear that other countries pursuing a digital sales tax could face similar action.Multinational companies including Google and Facebook have been criticised for paying very little tax in some countries despite booking large revenues due to the way profits can be reported in lower tax jurisdictions.A multilateral solution is being sought but some countries, including the UK, are introducing interim taxes.""On the digital services tax, I do think we need to look at the operation of the big digital companies and the huge revenues they have in this country and the amount of tax that they pay,"" Mr Johnson said late on Tuesday. ""We need to sort that out. They need to make a fairer contribution.""The UK's tax was first suggested by Philip Hammond, the former chancellor and could initially raise almost £500m a year. The pledge to implement the tax is contained in the Conservative manifesto.The Labour Party has also promised a tax on ""multinationals"".  In the party's press release about the plans last month, ""Amazon, Facebook and Google"" were mentioned specifically.France is imposing a 3% tax on any digital company with revenue of more than €750m ($850m; £670m), of which at least €25m is generated in France. The tax will be back-dated to early 2019, and is expected to raise about €400m this year."
